<?xml version="1.0" encoding="ASCII"?>


<!--
  The MIT License (MIT)
  
  Copyright (c) 2010 Technische Universitaet Berlin
  
  Permission is hereby granted, free of charge, to any person obtaining a copy
  of this software and associated documentation files (the "Software"), to deal
  in the Software without restriction, including without limitation the rights
  to use, copy, modify, merge, publish, distribute, sublicense, and/or sell
  copies of the Software, and to permit persons to whom the Software is
  furnished to do so, subject to the following conditions:
  
  The above copyright notice and this permission notice shall be included in
  all copies or substantial portions of the Software.
  
  THE SOFTWARE IS PROVIDED "AS IS", WITHOUT WARRANTY OF ANY KIND, EXPRESS OR
  IMPLIED, INCLUDING BUT NOT LIMITED TO THE WARRANTIES OF MERCHANTABILITY,
  FITNESS FOR A PARTICULAR PURPOSE AND NONINFRINGEMENT. IN NO EVENT SHALL THE
  AUTHORS OR COPYRIGHT HOLDERS BE LIABLE FOR ANY CLAIM, DAMAGES OR OTHER
  LIABILITY, WHETHER IN AN ACTION OF CONTRACT, TORT OR OTHERWISE, ARISING FROM,
  OUT OF OR IN CONNECTION WITH THE SOFTWARE OR THE USE OR OTHER DEALINGS IN
  THE SOFTWARE.
-->

<!--
  <dbh:method name="">
    <dbh:params>
      <dbh:param type="" name=""/>
      <dbh:param type="" name=""/>
      <dbh:param type="" name=""/>
      <dbh:param type="" name=""/>
    </dbh:params>
    <dbh:throws>
      <dbh:throwable name="SQLException"/>
    </dbh:throws>
    <dbh:doc>
    </dbh:doc>
    <dbh:body>
      <dbh:sqlComposer>
      </dbh:sqlComposer>
      <dbh:returnResultSet/>
    </dbh:body>
  </dbh:method>
-->

<dbh:DbHelper xmlns:dbh="http://www.mumie.net/xml-namespace/db-helper"
              xmlns:h="http://www.mumie.net/xml-namespace/html-in-javadoc"
              xmlns:xsi="http://www.w3.org/2001/XMLSchema-instance"
              xsi:schemaLocation="http://www.mumie.net/xml-namespace/db-helper DbHelper.xsd">

<!-- ================================================================================ -->
<!-- h1: Executing custom SQL                                                         -->
<!-- ================================================================================ -->

  <dbh:method name="query">
    <dbh:params>
      <dbh:param type="String" name="query"/>
      <dbh:param type="boolean" name="scrollable"/>
    </dbh:params>
    <dbh:throws>
      <dbh:throwable name="SQLException"/>
    </dbh:throws>
    <dbh:doc>
      * Executes the specified query and returns the corresponding result set.
    </dbh:doc>
    <dbh:body>
      <dbh:log printParams="yes">"Started"</dbh:log>
      int type = (scrollable ? ResultSet.TYPE_SCROLL_INSENSITIVE : ResultSet.TYPE_FORWARD_ONLY);
      Statement statement = this.connection.createStatement(type, ResultSet.CONCUR_READ_ONLY);
      ResultSet resultSet = statement.executeQuery(query);
      <dbh:log>"Done"</dbh:log>
      return resultSet;
    </dbh:body>
  </dbh:method>
  
<!-- ================================================================================ -->
<!-- h1: Querying entity data                                                         -->
<!-- ================================================================================ -->

<!-- ~~~~~~~~~~~~~~~~~~~~~~~~~~~~~~~~~~~~~~~~~~~~~~~~~~~~~~~~~~~~~~~~~~~~~~~~~~~~~~~~ -->
<!-- h2: Non-binary data                                                              -->
<!-- ~~~~~~~~~~~~~~~~~~~~~~~~~~~~~~~~~~~~~~~~~~~~~~~~~~~~~~~~~~~~~~~~~~~~~~~~~~~~~~~~ -->

  <dbh:method name="queryEntity">
    <dbh:params>
      <dbh:param type="int" name="type"/>
      <dbh:param type="int" name="id"/>
      <dbh:param type="String..." name="columns" hint="array"/>
    </dbh:params>
    <dbh:throws>
      <dbh:throwable name="SQLException"/>
    </dbh:throws>
    <dbh:doc>
      * Queries the specified columns of the entity with the specified type and id.
    </dbh:doc>
    <dbh:body>
      <dbh:sqlComposer>
        SELECT
        columns(this.filterColumns(columns))
        FROM
        table(DbTable.ofEntityTypeForRead(type))
        WHERE
        column(DbColumn.ID) = value(id)
      </dbh:sqlComposer>
      <dbh:returnResultSet/>
    </dbh:body>
  </dbh:method>

  <dbh:method name="queryEntityDatumAsTimestamp" returnType="Timestamp">
    <dbh:params>
      <dbh:param type="int" name="type"/>
      <dbh:param type="int" name="id"/>
      <dbh:param type="String" name="column"/>
    </dbh:params>
    <dbh:throws>
      <dbh:throwable name="SQLException"/>
    </dbh:throws>
    <dbh:doc>
      * Returns the specified column of the entity with the specified type and id
      * as a {@link Timestamp Timestamp} object.
    </dbh:doc>
    <dbh:body>
      <dbh:log printParams="yes">"Started"</dbh:log>
      ResultSet resultSet = this.queryEntity(type, id, column);
      if ( ! resultSet.next() )
        throw new SQLException
          (METHOD_NAME + ": Cannot find entity with type " + type + " and id " + id);
      Timestamp value = resultSet.getTimestamp(column);
      <dbh:log>"Done. value = " + LogUtil.dateToString(value)</dbh:log>
      return value;
    </dbh:body>
  </dbh:method>

  <dbh:method name="queryEntityDatumAsString" returnType="String">
    <dbh:params>
      <dbh:param type="int" name="type"/>
      <dbh:param type="int" name="id"/>
      <dbh:param type="String" name="column"/>
    </dbh:params>
    <dbh:throws>
      <dbh:throwable name="SQLException"/>
    </dbh:throws>
    <dbh:doc>
      * Returns the specified column of the entity with the specified type and id
      * as a string.
    </dbh:doc>
    <dbh:body>
      <dbh:log printParams="yes">"Started"</dbh:log>
      ResultSet resultSet = this.queryEntity(type, id, column);
      if ( ! resultSet.next() )
        throw new SQLException
          (METHOD_NAME + ": Cannot find entity with type " + type + " and id " + id);
      String value = resultSet.getString(column);
      <dbh:log>"Done. value = " + value</dbh:log>
      return value;
    </dbh:body>
  </dbh:method>
  
  <dbh:method name="queryEntityDatumAsInt" returnType="int">
    <dbh:params>
      <dbh:param type="int" name="type"/>
      <dbh:param type="int" name="id"/>
      <dbh:param type="String" name="column"/>
    </dbh:params>
    <dbh:throws>
      <dbh:throwable name="SQLException"/>
    </dbh:throws>
    <dbh:doc>
      * Returns the specified column of the entity with the specified type and id
      * as an <h:code>int</h:code> number.
    </dbh:doc>
    <dbh:body>
      <dbh:log printParams="yes">"Started"</dbh:log>
      ResultSet resultSet = this.queryEntity(type, id, column);
      if ( ! resultSet.next() )
        throw new SQLException
          (METHOD_NAME + ": Cannot find entity with type " + type + " and id " + id);
      int value = resultSet.getInt(column);
      <dbh:log>"Done. value = " + value</dbh:log>
      return value;
    </dbh:body>
  </dbh:method>
  
  <dbh:method name="queryEntityDatumAsLong" returnType="long">
    <dbh:params>
      <dbh:param type="int" name="type"/>
      <dbh:param type="int" name="id"/>
      <dbh:param type="String" name="column"/>
    </dbh:params>
    <dbh:throws>
      <dbh:throwable name="SQLException"/>
    </dbh:throws>
    <dbh:doc>
      * Returns the specified column of the entity with the specified type and id
      * as an <h:code>long</h:code> number.
    </dbh:doc>
    <dbh:body>
      <dbh:log printParams="yes">"Started"</dbh:log>
      ResultSet resultSet = this.queryEntity(type, id, column);
      if ( ! resultSet.next() )
        throw new SQLException
          (METHOD_NAME + ": Cannot find entity with type " + type + " and id " + id);
      long value = resultSet.getLong(column);
      <dbh:log>"Done. value = " + value</dbh:log>
      return value;
    </dbh:body>
  </dbh:method>
  
  <dbh:method name="queryEntityDatumAsBoolean" returnType="boolean">
    <dbh:params>
      <dbh:param type="int" name="type"/>
      <dbh:param type="int" name="id"/>
      <dbh:param type="String" name="column"/>
    </dbh:params>
    <dbh:throws>
      <dbh:throwable name="SQLException"/>
    </dbh:throws>
    <dbh:doc>
      * Returns the specified column of the entity with the specified type and id
      * as a boolean value.
    </dbh:doc>
    <dbh:body>
      <dbh:log printParams="yes">"Started"</dbh:log>
      ResultSet resultSet = this.queryEntity(type, id, column);
      if ( ! resultSet.next() )
        throw new SQLException
          (METHOD_NAME + ": Cannot find entity with type " + type + " and id " + id);
      boolean value = resultSet.getBoolean(column);
      <dbh:log>"Done. value = " + value</dbh:log>
      return value;
    </dbh:body>
  </dbh:method>

<!-- ~~~~~~~~~~~~~~~~~~~~~~~~~~~~~~~~~~~~~~~~~~~~~~~~~~~~~~~~~~~~~~~~~~~~~~~~~~~~~~~~ -->
<!-- h2: By path                                                                  -->
<!-- ~~~~~~~~~~~~~~~~~~~~~~~~~~~~~~~~~~~~~~~~~~~~~~~~~~~~~~~~~~~~~~~~~~~~~~~~~~~~~~~~ -->

  <dbh:method name="queryEntityByPath" target="PostgreSQLDbHelper">
    <dbh:params>
      <dbh:param type="int" name="type"/>
      <dbh:param type="String" name="path"/>
      <dbh:param type="String[]" name="columns"/>
      <dbh:param type="boolean" name="onlyLatest"/>
    </dbh:params>
    <dbh:throws>
      <dbh:throwable name="SQLException"/>
    </dbh:throws>
    <dbh:doc>
      * Returns the specified columns for the entities with the specified type and path.
      * If <h:code>onlyLatest</h:code> is <h:code>true</h:code>, only latest versions of
      * the entities are consdidered.
    </dbh:doc>
    <dbh:body>
      this.pathTokenizer.tokenize(path);
      String sectionPath = this.pathTokenizer.getSectionPath();
      String pureName = this.pathTokenizer.getPureName();
      <dbh:sqlComposer>
        SELECT
        columns(this.filterColumns(columns))
        FROM
        table(DbTable.ofEntityTypeForRead(type, onlyLatest))
        WHERE